{
  "$schema": "https://json-schema.org/draft/2020-12/schema",
  "$id": "https://github.com/OpenAdaptAI/.github/blob/main/schemas/evidence-registry.schema.json",
  "title": "OpenAdapt production evidence registry v2",
  "type": "object",
  "additionalProperties": false,
  "required": [
    "$schema", "schema_version", "repository", "repository_id",
    "repository_owner_id", "revision", "previous_registry_head_sha256",
    "registry_head_sha256", "signer_registry", "signer_registry_history", "entries"
  ],
  "properties": {
    "$schema": {"const": "schemas/evidence-registry.schema.json"},
    "schema_version": {"const": "openadapt.production-evidence-registry/v2"},
    "repository": {"const": "OpenAdaptAI/.github"},
    "repository_id": {"const": "858454062"},
    "repository_owner_id": {"const": "132681217"},
    "revision": {"type": "integer", "minimum": 1},
    "previous_registry_head_sha256": {"oneOf": [{"$ref": "#/$defs/digest"}, {"type": "null"}]},
    "registry_head_sha256": {"$ref": "#/$defs/digest"},
    "signer_registry": {
      "oneOf": [
        {"type": "null"},
        {
          "type": "object",
          "additionalProperties": false,
          "required": ["schema_version", "object_path", "object_sha256", "registry_identity_sha256", "registry_revision"],
          "properties": {
            "schema_version": {"const": "openadapt.qualification-signer-registry-pointer/v1"},
            "object_path": {"type": "string", "pattern": "^production-evidence/signer-registries/sha256/[0-9a-f]{2}/[0-9a-f]{64}\\.qualification-signer-registry\\.json$"},
            "object_sha256": {"$ref": "#/$defs/digest"},
            "registry_identity_sha256": {"$ref": "#/$defs/digest"},
            "registry_revision": {"type": "integer", "minimum": 1}
          }
        }
      ]
    },
    "signer_registry_history": {
      "type": "array",
      "uniqueItems": true,
      "items": {"$ref": "#/$defs/signer_registry_pointer"}
    },
    "entries": {
      "type": "array",
      "items": {
        "type": "object",
        "additionalProperties": false,
        "required": [
          "registry_entry_sha256", "kind", "object_schema_version", "object_path",
          "object_sha256", "size_bytes", "object_media_type",
          "semantic_identity_sha256", "subject_sha256"
        ],
        "properties": {
          "registry_entry_sha256": {"$ref": "#/$defs/digest"},
          "kind": {"type": "string", "pattern": "^[a-z][a-z0-9-]{1,95}$"},
          "object_schema_version": {"type": "string", "minLength": 1, "maxLength": 160},
          "object_path": {"type": "string", "pattern": "^production-evidence/objects/sha256/[0-9a-f]{2}/[0-9a-f]{64}\\.[a-z][a-z0-9-]{1,95}\\.json$"},
          "object_sha256": {"$ref": "#/$defs/digest"},
          "size_bytes": {"type": "integer", "minimum": 1},
          "object_media_type": {"type": "string", "minLength": 1, "maxLength": 200},
          "semantic_identity_sha256": {"$ref": "#/$defs/digest"},
          "subject_sha256": {"oneOf": [{"$ref": "#/$defs/digest"}, {"type": "null"}]}
        }
      }
    }
  },
  "$defs": {
    "digest": {"type": "string", "pattern": "^sha256:[0-9a-f]{64}$"},
    "signer_registry_pointer": {
      "type": "object",
      "additionalProperties": false,
      "required": ["schema_version", "object_path", "object_sha256", "registry_identity_sha256", "registry_revision"],
      "properties": {
        "schema_version": {"const": "openadapt.qualification-signer-registry-pointer/v1"},
        "object_path": {"type": "string", "pattern": "^production-evidence/signer-registries/sha256/[0-9a-f]{2}/[0-9a-f]{64}\\.qualification-signer-registry\\.json$"},
        "object_sha256": {"$ref": "#/$defs/digest"},
        "registry_identity_sha256": {"$ref": "#/$defs/digest"},
        "registry_revision": {"type": "integer", "minimum": 1}
      }
    }
  }
}
