{"$schema":"schemas/evidence-registry.schema.json","entries":[{"kind":"qualification-authority-state-receipt","object_media_type":"application/vnd.openadapt.qualification-authority-state-receipt+json;version=2","object_path":"production-evidence/objects/sha256/79/79d8567cdc415841fa80e8df797f7fb3e50ca52c7d50faae6363bb5f373a5ab8.qualification-authority-state-receipt.json","object_schema_version":"openadapt.qualification-authority-state-receipt/v2","object_sha256":"sha256:79d8567cdc415841fa80e8df797f7fb3e50ca52c7d50faae6363bb5f373a5ab8","registry_entry_sha256":"sha256:ed4e228c703498e1d1975db78f91d70ef3edf766c485bb0c76e2350005e1c270","semantic_identity_sha256":"sha256:ea973da8b764f89a56e9f74100c049d3c5d92d8e31b2a42131651242aca44dfb","size_bytes":1539,"subject_sha256":null},{"kind":"qualification-authority-state-receipt-sigstore-bundle","object_media_type":"application/vnd.dev.sigstore.bundle.v0.3+json","object_path":"production-evidence/objects/sha256/38/387299d48bac465b6ab50e422f959ba82509e809ffb2fdecf88f1f17292f83af.qualification-authority-state-receipt-sigstore-bundle.json","object_schema_version":"application/vnd.dev.sigstore.bundle.v0.3+json","object_sha256":"sha256:387299d48bac465b6ab50e422f959ba82509e809ffb2fdecf88f1f17292f83af","registry_entry_sha256":"sha256:f475af53f1f6f945b990132a737f0cbd91d10afc798ef95d1c1e80cf9c6ca788","semantic_identity_sha256":"sha256:694873d75e611ab9a5abf9b9e0b1f5bcc6fb36adb9c55437d614f28c87d22772","size_bytes":2833,"subject_sha256":"sha256:79d8567cdc415841fa80e8df797f7fb3e50ca52c7d50faae6363bb5f373a5ab8"},{"kind":"qualification-revocation-state-receipt","object_media_type":"application/vnd.openadapt.qualification-revocation-state-receipt+json;version=1","object_path":"production-evidence/objects/sha256/fb/fb49de0a2c3194f14368ccf660eb8ddb8af2daf0128814edbee9869fdaabf0a5.qualification-revocation-state-receipt.json","object_schema_version":"openadapt.qualification-revocation-state-receipt/v1","object_sha256":"sha256:fb49de0a2c3194f14368ccf660eb8ddb8af2daf0128814edbee9869fdaabf0a5","registry_entry_sha256":"sha256:796fff26c81d3e69072030131fad5848226073bc56511415ee89c959439da22f","semantic_identity_sha256":"sha256:36fa86bae55a9a5577c5f173ab1efcb3f66a8c24a0b2a3e5efad6f5bbc5aa78e","size_bytes":1475,"subject_sha256":null},{"kind":"qualification-revocation-state-receipt-sigstore-bundle","object_media_type":"application/vnd.dev.sigstore.bundle.v0.3+json","object_path":"production-evidence/objects/sha256/36/36d43d79687c3433fc625c5199c5ac475d514488de8ef0d2529d1830a61be3ee.qualification-revocation-state-receipt-sigstore-bundle.json","object_schema_version":"application/vnd.dev.sigstore.bundle.v0.3+json","object_sha256":"sha256:36d43d79687c3433fc625c5199c5ac475d514488de8ef0d2529d1830a61be3ee","registry_entry_sha256":"sha256:f6d162f628eb3f8543cd24af13565a30cedc2a7c5ea66f3e0a7af041f807c1d0","semantic_identity_sha256":"sha256:6ac05148f666f91aad64acd3ee4119c7fc37fa7ed2e7813f78c723c6c6f26aec","size_bytes":2841,"subject_sha256":"sha256:fb49de0a2c3194f14368ccf660eb8ddb8af2daf0128814edbee9869fdaabf0a5"},{"kind":"qualification-evidence-decision-receipt","object_media_type":"application/vnd.openadapt.qualification-evidence-decision-receipt+json;version=2","object_path":"production-evidence/objects/sha256/9e/9e431a00816415c20ac2d6416020a36e8756d2259f036fc311fa84dc4f74fa3a.qualification-evidence-decision-receipt.json","object_schema_version":"openadapt.qualification-evidence-decision-receipt/v2","object_sha256":"sha256:9e431a00816415c20ac2d6416020a36e8756d2259f036fc311fa84dc4f74fa3a","registry_entry_sha256":"sha256:580c1f145e0bc38accb0a4b7fd679175732dd526ba74cc5b717df7be9ab8b608","semantic_identity_sha256":"sha256:c18d69bdfb145139581ea6865f513179bd104cb02a64d838f93e49f96d9d3769","size_bytes":6654,"subject_sha256":null},{"kind":"qualification-evidence-decision-receipt-sigstore-bundle","object_media_type":"application/vnd.dev.sigstore.bundle.v0.3+json","object_path":"production-evidence/objects/sha256/74/747e92ee1be132c595dec33c9a4cd59cf3df456e00fc7a4cf9668249e4e8c1f7.qualification-evidence-decision-receipt-sigstore-bundle.json","object_schema_version":"application/vnd.dev.sigstore.bundle.v0.3+json","object_sha256":"sha256:747e92ee1be132c595dec33c9a4cd59cf3df456e00fc7a4cf9668249e4e8c1f7","registry_entry_sha256":"sha256:e805345a6b00a12d3bad82338db6f5d4e1ec01537ec2fd8c89504acd2c28cc24","semantic_identity_sha256":"sha256:ac2a961e1e72d016354b0460263ade093f647ba4bd215e1e5858a19a431720af","size_bytes":2873,"subject_sha256":"sha256:9e431a00816415c20ac2d6416020a36e8756d2259f036fc311fa84dc4f74fa3a"}],"previous_registry_head_sha256":null,"registry_head_sha256":"sha256:d5b1d8b818ee69e732f274234fac3ecc75dfaa62dfddbf54a9336f0c7fd6ce6c","repository":"OpenAdaptAI/.github","repository_id":"858454062","repository_owner_id":"132681217","revision":1,"schema_version":"openadapt.production-evidence-registry/v2","signer_registry":{"object_path":"production-evidence/signer-registries/sha256/1a/1a95efc9c22e2c7f6139050469bc3ea282c1e7611abc0bdc0e3aecba5a38b677.qualification-signer-registry.json","object_sha256":"sha256:1a95efc9c22e2c7f6139050469bc3ea282c1e7611abc0bdc0e3aecba5a38b677","registry_identity_sha256":"sha256:728e0d4f7c2a85a256ae3bf95a3ed56708daf818252c2b19525efc61e81ca1bc","registry_revision":1,"schema_version":"openadapt.qualification-signer-registry-pointer/v1"},"signer_registry_history":[{"object_path":"production-evidence/signer-registries/sha256/1a/1a95efc9c22e2c7f6139050469bc3ea282c1e7611abc0bdc0e3aecba5a38b677.qualification-signer-registry.json","object_sha256":"sha256:1a95efc9c22e2c7f6139050469bc3ea282c1e7611abc0bdc0e3aecba5a38b677","registry_identity_sha256":"sha256:728e0d4f7c2a85a256ae3bf95a3ed56708daf818252c2b19525efc61e81ca1bc","registry_revision":1,"schema_version":"openadapt.qualification-signer-registry-pointer/v1"}]}
